{
  "schema_version": 1,
  "level_id": "global_demo_001",
  "level_version": 1,
  "mode": "find_anachronism",
  "assets": {
    "image": {"asset_id":"image_demo_001","url":"https://cdn.example.com/assets/image_demo_001.webp","sha256":"aaaaaaaaaaaaaaaaaaaaaaaaaaaaaaaaaaaaaaaaaaaaaaaaaaaaaaaaaaaaaaaa","bytes":120000,"content_type":"image/webp"},
    "width": 1536,
    "height": 1024
  },
  "differences": [
    {"id":"d1","shape":"circle","x":0.2,"y":0.3,"radius":0.03,"difficulty":1,"operation":"anachronism"},
    {"id":"d2","shape":"circle","x":0.5,"y":0.4,"radius":0.025,"difficulty":2,"operation":"color"},
    {"id":"d3","shape":"circle","x":0.7,"y":0.6,"radius":0.02,"difficulty":3,"operation":"replace"},
    {"id":"d4","shape":"polygon","points":[{"x":0.3,"y":0.7},{"x":0.35,"y":0.68},{"x":0.34,"y":0.75}],"difficulty":3,"operation":"shape"},
    {"id":"d5","shape":"circle","x":0.82,"y":0.22,"radius":0.018,"difficulty":4,"operation":"direction"}
  ],
  "tags": {"regions":["global"],"themes":["cozy_home"],"styles":["cute"],"scenes":["living_room"],"risk":[]},
  "difficulty": {"total":2,"object_size":2,"color_similarity":2,"visual_density":3,"edge_distance":1,"semantic_obviousness":2}
}
